{
  "_type": "unknown",
  "url": "https://2e.aonprd.com/Rules.aspx?ID=1863&NoRedirect=1",
  "entity_id": 1863,
  "name": "",
  "rarity": "common",
  "pfs": null,
  "legacy": false,
  "alt_edition_url": null,
  "traits": [],
  "trait_ids": {},
  "source": {
    "book": null,
    "page": null,
    "source_id": null
  },
  "sources": [],
  "sections": [],
  "raw_fields": {},
  "links": [],
  "body_text": "",
  "body_html": "",
  "meta_description": null,
  "meta_keywords": null
}